160,Cetak Rekening Koran,"Untuk pengecekan rekening koran bisa dilakukan melalui aplikasi JakOne Mobile dan melalui Kantor Cabang Bank DKI. Jika pengecekan rekening koran melalui JakOne Mobile dapat mengikuti langkah-langkah sebagai berikut:
 
 1. Pilih produk jasa dan info rekening
 2. Pilih Rekening Koran
 3. Pilih Periode bulan yang ingin diunduh
 4.Rekening Koran Berhasil di Download dan Dikirim ke Email
 
Mohon dipastikan kembali email yang terdaftar di akun JakOne Mobile dalam keadaan aktif dan berkenan memeriksa pada bagian Spam, Junk, atau Promotion pada email.
 
Rekening koran melalui JakOne Mobile bisa diunduh untuk tiga bulan terakhir dan untuk bulan yang sudah dilalui dikarenakan untuk bulan yang masih berjalan belum tersedia untuk diunduh.
 
Jika tidak memiliki aplikasi JakOne Mobile silahkan melakukan cetak rekening koran melalui Kantor Cabang Bank DKI dengan datang langsung ke Kantor Cabang Pembukaan Rekening dengan membawa kelengkapan dokumen berupa: KTP asli, Buku Tabungan, Kartu ATM Bank DKI, dan Biaya administrasi cetak Rekening Koran sebesar Rp. 2.500,00 / lembar.
 
Kantor Cabang Bank DKI buka pada hari Senin - Jumat (tidak termasuk hari libur nasional), dari jam 08.00 s.d 15.00 WIB.","rekening koran, cetak rekening",usr.cetak_rekening_koran,cetak rekening koran gimana ya?,sediakan mekanisme untuk mengecek rekening koran,"kalau perlu melakukan cetak rekening koren, langkahnya apa saja",jelaskan soal prosedur pengecekan rekening koran di jakone,apakah saya bisa mencetak rekening koran melalui jakone,tahukah kamu soal cara agar bisa mencetak rekening koran,"saya perlu untuk melakukan pengecekan rekening koran saya, bisakah sediakan tata caranya?",prosedur untuk cetak rekening min,di mana saya bisa melakukan pencetakan rekening koran,saya ingin mencetak rekening koran untuk enam bulan terakhir. Apakah bisa dilakukan melalui JakOne Mobile?,"jika saya tidak memiliki JakOne Mobile, bagaimana cara mendapatkan rekening koran?",kamu ngerti buat cetak rekening perlu apa saja?,"Kalau mau lihat rekening koran lewat JakOne Mobile, gimana caranya?","aku butuh rekening koran buat urusan penting, bisa langsung jadi nggak?",pegurusan cetak rekening koran seperti apa ya?,umumnya untuk cetak rekening koran harus bagaimana?,kemana supaya kita bisa cetak rekening koran,"aku butuh buat cetak rekening koran nih, caranya bagaimana",mohon untuk sediakan informasi detail untuk cetak rekening koran,apakah ada cara lain selain datang ke bank untuk mendapatkan rekening koran?,proses cetak rekening koran seperti apa? dan perlu bayar kah?,ini ga harus ke kantor cabang kan buat cetak rekening koran,bisa kan buat lakukan cetak rekening tanpa perlu datang ke kantor cabang,"untuk prosedur percetakan rekening koran itu apa saja, perlukah biaya untuk mencetaknya?","jika saya ingin mencetak rekening koran untuk satu tahun terakhir, bagaimana prosedurnya?","kalau mau ambil rekening koran di bank, bisa langsung datang atau harus bikin janji dulu",kalau mau datang langsung ke kantor cabang buat urus cetak rekening tuh bisa kan?,ada ga cara yang simpel buat cetak rekening tanpa harus repot-repot ke kantor cabang?,detail informasi mengenai cara untuk mencetak rekening koran,rekening koran dapat dicetak di aplikasi jakone kah?,alur untuk mencetak rekening koran ,ingin cetak rekening koran syaratnya apa saja?,panduan cetak rekening,jika ingin mencetak rekening apa saja langkah yang dilakukan ,eh tahu gak cetak rekening koran gimana caranya,mengenai rekening koran kalau ingin mencetak gimana tahapannya,bisa dibantu untuk proses pencetakan rekening koran ,apakah cetak rekening bisa dilakukan online,biar bisa cetak rekening gimana  caranya ya,bisa dibantu untuk proses cetak rekening?,apabila ingin mencetak rekening koran maka prosedurnya,kamu tahu mengenai rekening koran itu cara cetaknya gimana,biasanya untuk cetak rekening harus lakukan apa,rekening koran bisa dicetak dengan cara,prosedur pencetakan rekening koran di jakone,apakah kamu tahu soal rekening koran? gimana tuh caranya biar bisa dicetak,bisa dibantu gak kak untuk cetak rekening itu,"jika saya ingin mencetak rekening koran, maka prosesnya seperti apa",langkah yang harus dilakukan untuk melakukan pencetakan rekening koran,mohon dipandu untuk langkah dalam mencetak rekening,jika perlu rekening koran dapat mengeceknya melalui,kaya gimana cara cek rekening koran ,kalau mau cetak rekening harus ke kantor cabang dulu ya?,pencetakan rekening kayak gimana sih,ada rekening koran kan? itu cara ceknya bagaimana,"saya butuh rekening koran, gimana cara melihatnya",cek rekening koran dong,tolong kasih tau cara cek rekening koran,mau cetak rekening nih kasih tau alurnya ya,mekanisme untuk cek rekening koran ada gak min?,,,,,,,,,,
161,Pencairan KJP,"Kami informasikan mohon kesediaan dari Bapak/Ibu untuk dapat menunggu sampai proses Pendistribusian Bantuan Program untuk Kartu Jakarta Pintar (KJP) selesai. Untuk informasi lebih lanjut tentang pencairan dana KJP Plus, Berkenan Bapak/Ibu dapat mengikuti instagram @disdikdki, @upt.p4op dan @jakonemobile, atau dapat menghubungi Dinas Pendidikan melalui alamat email p4opdisdik@jakarta.go.id serta dapat datang langsung untuk mengetahui informasi lebih lanjut dikarenakan pencairan dana merupakan wewenang dari Dinas P4OP.","pencairan KJP, KJP cair",usr.pencairan_kjp,informasi pencairan KJP,"kjp kapan cairnya, ada info?",kamu tahu ga soal pencairan kjp,kjp proses pencairannya bagaimana,seperti apa prosedur pencairan kjp bulan ini,kamu ada informasi yang tersedia soal kjp ga?,apakah ada keterlambatan pencairan kjp ya kak?,dapat informasi soal kjp biasanya dimana?,"biar tetep up to date soal pencairan kjp, bisa akses informasi dimana?",bisa dibantu untuk penciaran kjp itu kapan dan bagaimana?,mekanisme untuk pencairan kjp gimana ya min,kjp cairnya kapan nih? udah nunggu banget,"ga sabar kjp cair, tahu ga kapan?","ini kjp kapan masuk rekening, udah waktunya ga sih",kok ya kjp belum cair-cair sih?,dapet info soal pencairan kjp nih biasanya dimana,kamu sediakan informasi tentang pencairan kjp ga nih?,"halo, bisa dibantu untuk mencari informasi terkait pencairan kjp",soal pencairan kjp itu biasanya kapan?,"umumnya, kjp akan cair pada saat apa?",punya info baru ga soal pencairan kjp,"butuh uang, kjp kapan cair?",kapan sih kjp dananya kelar didistribusikan?,"eh, kjp bulan ini udah bisa diambil?",bulan ini apakah dana kjp sudah bisa diambil,uang kjp udah cair belum min? ada info?,udah bisa belum kalau mau ngambil dana kjp kita ya,apakah sudah ada pengumuman resmi mengenai jadwal pencairan kjp bulan ini?,ada info resmi dari Disdik soal pencairan KJP?,"saya butuh dana KJP segera, apakah bisa dicairkan lebih cepat?",pencairan kjp sudah diproses belum,tolong dibantu untuk pencairan kjp min,adakah info terbaru untuk pencairan kjp,untuk kjp apakah bisa cair sekarang,mau tahu buat pencairan kjp apakah sudah ada info detailnya,kjp udah cair belum ya?,apakah kjp bisa dicairkan segera,pencairan kjp sudah ada info terbaru belum,kenapa kjp teman anak saya sudah cair sedangkan punya anak saya belum,penyebab kjp belum cair,"kjp anak tetangga saya sudah cair, apakah ada jadwal berbeda untuk pencairannya","untuk kjp yang belum cair, apakah ada prosedur yang harus dilakukan?",ke mana harus menghubungi pencairan kjp yang belum masuk?,kjp belum cair ke rekening,adakah kendala yang menyebabkan pencairan kjp belum merata,"mohon bantuan, kjp anakku belum cair sedangkan teman temannya sudah","penyebab kjp saya belum cair, sementara yang lain sudah",pencairan kjp dilakukan bertahap atau serentak,"jika kjp tidak kunjung cair, apa langkah yang harus diambil?","perlu dana kjp, apakah bisa dicairkan lebih cepat?",siapa yang bisa saya hubungi untuk pencairan kjp,mohon dipandu untuk pencairan kjp seperti apa,gimana biar kjp bisa cair,nasib pencairan kjp gimana min? lagi butuh duit nih,apa yang perlu dilakukan agar kjp cair secepatnya,adakah prosedur tambahan untuk mempercepat pencairan kjp,kontak yang bisa dihubungi untuk pencairan kjp ada gak,perkembangan terbaru pencairan kjp,eh kjp kok belum cair ya?,waduh pencairan kjp belum masuk rekening nih,,,,,,,,,,
162,Aplikasi JakOne Mobile tidak tersedia di playstore,"Sebelumnya mohon maaf atas ketidaknyamanannya. Kami informasikan bahwa saat ini Aplikasi JakOne Mobile sedang peningkatan jaringan sehingga tidak tersedia pada Play Store dan App Store dan tidak bisa melakukan Registrasi, Aktivasi pada Jakone Mobile. Disarankan dapat mencoba kembali beberapa waktu kedepan.","Jakone tidak ada di playstore, jakone ga ada di playstore, jakone tidak muncul di playstore",usr.aplikasi_jakone_tidak_tersedia_di_playstore,kok aplikasi jakone ga ada di plystore ya?,aplikasi jakone tidak tersedia saat ini di playstore,boleh tahu kenapa jakone ga ada di playstore,"waktu dicari di playstore, aplikasi jakone ga ada min",kenapa nih jakone ga muncul di playstore,bisa dibantu ga nih kok jakone ga ada di playstore,"aku udah cari di playstore aplikasi jakone, tapi kenapa ga ada?",aplikasi jakone yang tidak muncul di playstore,jakone tidak bisa diunduh lewat playstore kah?,di playstore ga ada aplikasi jakone kak,"saya cari aplikasi jakone dan ga ada di playstore, kenapa ya?",mengapa jakone tidak hadir di playstore,alasan yang membuat jakone tidak ada di app store,"di app store punyaku ga ada jakone ya, kenapa tuh?",informasi soal jakone yang ga ada di app store,infonya dong min kok jakone ga tersedia di app store dan playstore,"aku dah cari di app store dan playstore tapi ga nemu jakone, emang ga ada kah?",ini memang tidak tersedia jakone ya di app store?,jakone ga muncul di app store kah min?,memang ini dasarnya jakone ga tersedia di app store atau kenapa ya?,waktu cari lewat play store kenapa jakone ga ada nih,tahu ga kenapa jakone ga muncul di app store,baik di app store atau di playstore nih jakone ga ada terus tuh kenapa ya?,kok bisa di app store ga tersedia jakone?,kepo kenapa di playstore sama app store waktu cari aplikasi jakone pasti ga munvul,ini kok ga muncul ya pas mau cari aplikasi jakone di playstore,latar belakang mengapa jakone tidak tersedia di playstore maupun app store,apakah memang jakone tidak ada di app store?,bagaimana bisa di app store maupun playstore tidak muncul jakone,jakone memang ga dimunculin di playstore kah?,gak nemuin jakone di play store,"kenapa saat saya cari jakone di app store, aplikasinya tidak ada?",jakone hilang dari play store,apakah kamu tau kenapa jakone tidak muncul di app store ,penyebab jakone tidak tersedia di play store ,"pas cari jakone di app store, kok gak muncul ya",permisi min apa alasan jakone tidak tersedia di play store,mau unduh jakone di app store tapi tidak ada,bisa dibantu gak kak kenapa jakone gak muncul di play store saya,kemarin jakone masih ada kenapa sekarang hilang dari app store,butuh jakone tapi gak ketemu di playstore,"ingin unduh jakone di app store tapi tidak muncul, adakah solusi?","halo min, jakone masih beroperasi gak sih? kok di play store gak ada?",jakone gak bisa dicari di app store,akses jakone dari play store kenapa ditiadakan,"jakone gak muncul di playstore saya, apakah hp saya yang bermasalah?",emangnya jakone gak dirilis kah di app store,"misi kak, jakone udah gak aktif kah? kenapa hilang dari play store?",tadi pagi mau unduh jakone di app store tapi gak ketemu,tahukah kamu soal jakone yang tidak ada di play store,info terkait ketiadaan jakone di app store,faktor jakone ditarik dari play store,mengapa jakone menghilang tiba tiba dari app store,akankah jakone kembali tersedia di play store,"jakone gak muncul di app store, sedang ada perbaikan kah?","saya ingin mengunduh jakone di play store, tapi tidak bisa menemukannya",eh jakone ke mana ya? kok nggak ada sih di app store?,"jakone gak bisa dicari di app store, hp saya yang bermasalah atau gimana nih?",jakone masih beroperasi gak? kok di play store gak muncul?,apakah jakone menghilang permanen dari app store,,,,,,,,,,