parent_id,id,respond,Freetext,intent_name,sample_text1,sample_text2,sample_text3,sample_text4,sample_text5,sample_text6,sample_text7,sample_text8,sample_text9,sample_text10,sample_text11,sample_text12,sample_text13,sample_text14,sample_text15,sample_text16,sample_text17,sample_text18,sample_text19,sample_text20,sample_text21,sample_text22,sample_text23,sample_text24,sample_text25,sample_text26,sample_text27,sample_text28,sample_text29,sample_text30,sample_text31,sample_text32,sample_text33,sample_text34,sample_text35,sample_text36,sample_text37,sample_text38,sample_text39,sample_text40,sample_text41,sample_text42,sample_text43,sample_text44,sample_text45,sample_text46,sample_text47,sample_text48,sample_text49,sample_text50,sample_text51,sample_text52,sample_text53,sample_text54,sample_text55,sample_text56,sample_text57,sample_text58,sample_text59,sample_text60
2,Agent Availablea,"Baik, saya akan menghubungkan Anda dengan petugas layanan pelanggan kami.

ğŸ’¬ Mohon tunggu sebentar, Anda sedang dialihkan ke Customer Service yang tersedia.

Silakan masukkan detail pertanyaan atau kendala Anda",,usr.agent_available_id,chat dengan live agent,tolong sambungkan saya ke CS yang sedang bertugas.,bisa arahkan saya ke petugas layanan pelanggan yang sedang online?,ada CS standby sekarang? tolong hubungkan.,mohon alihkan obrolan ini ke customer service.,"kalau mau bicara langsung dengan petugas layanan, caranya gimana?","saya perlu konsultasi dengan CS, bisa segera dihubungkan?",hubungkan saya ke petugas yang bisa menjawab pertanyaan saya sekarang.,ada staf layanan pelanggan yang bisa bantu jawab?,bisa langsung sambungkan ke CS saja biar cepat.,"saya ingin ngobrol langsung dengan customer service, bisa?",tolong arahkan saya ke bagian layanan pelanggan.,bisa minta dialihkan ke customer service untuk diskusi lebih lanjut?,hubungkan ke CS yang sedang available ya.,"saya mau tanya langsung ke petugas layanan, bisa dialihkan?",mohon segera sambungkan saya dengan customer service.,mohon bantu arahkan ke petugas layanan pelanggan yang tersedia.,"kalau bisa, saya ingin langsung dialihkan ke customer service.
",tolong hubungkan saya ke CS untuk klarifikasi masalah.,"ada petugas yang bisa membantu secara langsung?
","ada pertanyaan yang mau aku tanyain, bisa hubungkan ke cutomer service yang tersedia","apakah sekarang ada customer service yang tersedia, ada yang mau kutanyakan","eh, hubungkan ke bagian cs dong",bisa ga sih kalau aku mau hubungi cs gitu,bantu agar aku bisa terhubung ke petugas layanan pelanggan,ada petugas layanan pelanggan yang bisa ditanya-tanya sekarang ga ya,"duh, urgent, aku perlu tanya sama cs sekarang, hubungkan kami dong",segera hubungkan saya dengan petugas layanan pelanggan yang tersedia,customer service yang available ada ga? hubungkan kami tolong,"terjadi sesuatu dan saya ingin bertanya langsung kepada customer service, bisa hubungi mereka untuk saya?","apabila terjadi kendala, apakah mungkin untuk dihubungkan ke petugas pelayanan?",petugas layanan pelanggan mana yang bisa segera dihubungi? saya butuh segera,"permisi, sambungkan ke customer service ya",apakah tersedia petugas yang bisa membantu saya bila terjadi kendala,bisakah saya terhubung ke bagian cs karena ada beberapa pertanyaan,apakah mungkin terhubung ke cs secara langsung,"jika masalah tidak bisa diselesaikan, saya dapat disambungkan ke bagian cs kan?",bisa alihkan saya ke petugas layanan pelanggan sekarang kak?,adakah cs yang bisa merespons saya segera,customer service mana yang cepat responsnya?,bisa hubungkan saya dengan agent yang tersedia?,saya ingin bicara langsung dengan customer service,tolong sambungkan saya ke agent sekarang,ada agent yang bisa bantu saya langsung?,bisa minta bantuan dari petugas layanan pelanggan?,"mau tanya langsung ke CS, bisa?",apakah ada agent available untuk bantu saya sekarang?,bisa disambungkan ke customer service aktif?,"saya perlu ngobrol langsung dengan petugas, mohon dibantu",ada agent online sekarang? saya perlu bantuan langsung,"min, saya ingin terhubung dengan petugas layanan",tolong arahkan saya ke agent yang sedang online,"saya butuh bantuan dari CS langsung, bisa disambungkan","ingin bicara dengan agen langsung, bisa ga min?",bisa saya minta bantuan langsung dari petugas?,"tolong sambungkan saya ke CS, saya butuh bantuan cepat","perlu bantuan agent sekarang, bisa dibantu sambungkan",adakah petugas pelayanan yang bisa saya ajak bicara sekarang,mohon sambungkan ke agent karena ini cukup urgent,"saya lebih nyaman ngobrol langsung dengan agent, bisa?"
